{
 "schema": "m3a.review-queue/1",
 "store": "local",
 "date": "2026-10-27",
 "submissions": [],
 "clips": [
  {
   "ref": "CMU_CURATED/Jump_Twist@1a620aad67ce",
   "id": "CMU_CURATED/Jump_Twist",
   "hash": "1a620aad67cefa50fd971e66a6415ab0bd39decf53918e43c8d63918025f51ab",
   "tier": "cmu",
   "review": null,
   "stale": false,
   "numbers": {
    "verdict": "fail",
    "findings": 9,
    "fail": 2,
    "dur": 4.167,
    "keys": 85,
    "fit": [
     12,
     101
    ],
    "metrics": {
     "slide": 83.07,
     "skate": 22.74,
     "penetration": 19.33,
     "bodyPenetration": 110.79,
     "intersection": 0.14,
     "jitter": 50.56,
     "pop": 539.01,
     "twistFlip": 177,
     "jointLimit": 49,
     "stretch": 0,
     "seam": 0,
     "seamVelocity": 0,
     "fit": 12,
     "nan": 0,
     "events": 0,
     "symmetry": 0,
     "skateMean": 9.97
    }
   }
  },
  {
   "ref": "STYLE100_IDLE/CrossOver_Idle@86f67ef066cb",
   "id": "STYLE100_IDLE/CrossOver_Idle",
   "hash": "86f67ef066cb0802e63ede5d76f4cecaffbe9420cfea367647389fa2ab3b6ee8",
   "tier": "cc-by",
   "review": null,
   "stale": false,
   "numbers": {
    "verdict": "pass",
    "findings": 0,
    "fail": 0,
    "dur": 2.5,
    "keys": 5,
    "fit": [
     4,
     10
    ],
    "metrics": {
     "slide": 1.97,
     "skate": 0.08,
     "penetration": 0,
     "bodyPenetration": 0,
     "intersection": 0.37,
     "jitter": 0,
     "pop": 20.59,
     "twistFlip": 25,
     "jointLimit": 4,
     "stretch": 0,
     "seam": 0,
     "seamVelocity": 19.27,
     "fit": 4,
     "nan": 0,
     "events": 0,
     "symmetry": 0,
     "skateMean": 0.06
    }
   }
  },
  {
   "ref": "STYLE100_IDLE/OnPhoneLeft_Idle@6bb13cd9f9d2",
   "id": "STYLE100_IDLE/OnPhoneLeft_Idle",
   "hash": "6bb13cd9f9d249f5c9ebbb81e86724df12244dcdd0e131c56f6ffbdfb87ea18d",
   "tier": "cc-by",
   "review": null,
   "stale": false,
   "numbers": {
    "verdict": "pass",
    "findings": 0,
    "fail": 0,
    "dur": 2.7,
    "keys": 4,
    "fit": [
     6,
     12
    ],
    "metrics": {
     "slide": 8.28,
     "skate": 0.31,
     "penetration": 0,
     "bodyPenetration": 0,
     "intersection": 0.21,
     "jitter": 0,
     "pop": 15.39,
     "twistFlip": 16,
     "jointLimit": 10,
     "stretch": 0,
     "seam": 0,
     "seamVelocity": 47.03,
     "fit": 6,
     "nan": 0,
     "events": 0,
     "symmetry": 0,
     "skateMean": 0.2
    }
   }
  },
  {
   "ref": "STYLE100_IDLE/GracefulArms_Idle@63b0bea309c3",
   "id": "STYLE100_IDLE/GracefulArms_Idle",
   "hash": "63b0bea309c34c6d1b98cf581a97d79846e6ef0700945e4c945f5ea6299b92d1",
   "tier": "cc-by",
   "review": null,
   "stale": false,
   "numbers": {
    "verdict": "pass",
    "findings": 0,
    "fail": 0,
    "dur": 2.5,
    "keys": 4,
    "fit": [
     6,
     20
    ],
    "metrics": {
     "slide": 0,
     "skate": 0,
     "penetration": 0,
     "bodyPenetration": 0,
     "intersection": 0.04,
     "jitter": 0,
     "pop": 14.68,
     "twistFlip": 9,
     "jointLimit": 7,
     "stretch": 0,
     "seam": 0,
     "seamVelocity": 20.8,
     "fit": 6,
     "nan": 0,
     "events": 0,
     "symmetry": 0,
     "skateMean": 0
    }
   }
  },
  {
   "ref": "CMU_CURATED/Pick_Up_Basket@04c9a32eadf4",
   "id": "CMU_CURATED/Pick_Up_Basket",
   "hash": "04c9a32eadf41b3e2508f47dd22873692228164babc127289fcf14aab5ecff6b",
   "tier": "cmu",
   "review": {
    "state": "approved",
    "by": "owner",
    "date": "2026-10-22",
    "motion": "04c9a32eadf41b3e2508f47dd22873692228164babc127289fcf14aab5ecff6b",
    "note": "Idk, they walk up, pick up, turn right spin 360 degrees and back pedal,"
   },
   "stale": false,
   "numbers": {
    "verdict": "pass",
    "findings": 0,
    "fail": 0,
    "dur": 4.3,
    "keys": 76,
    "fit": [
     10,
     88
    ],
    "metrics": {
     "slide": 37.07,
     "skate": 11.21,
     "penetration": 12.54,
     "bodyPenetration": 0,
     "intersection": 0.89,
     "jitter": 15.8,
     "pop": 859.75,
     "twistFlip": 43,
     "jointLimit": 34,
     "stretch": 0,
     "seam": 0,
     "seamVelocity": 0,
     "fit": 10,
     "nan": 0,
     "events": 0,
     "symmetry": 0,
     "skateMean": 4.64
    }
   }
  },
  {
   "ref": "CMU_CURATED/Wrench_Bolt@fb26b9a3a9c1",
   "id": "CMU_CURATED/Wrench_Bolt",
   "hash": "fb26b9a3a9c1de8769d61ca71eeed63f16ed4a02143fe804b0c0b43ac17fc7a1",
   "tier": "cmu",
   "review": {
    "state": "approved",
    "by": "owner",
    "date": "2026-10-22",
    "motion": "fb26b9a3a9c1de8769d61ca71eeed63f16ed4a02143fe804b0c0b43ac17fc7a1",
    "note": "Look fine not sure what its for"
   },
   "stale": false,
   "numbers": {
    "verdict": "pass",
    "findings": 0,
    "fail": 0,
    "dur": 6,
    "keys": 23,
    "fit": [
     11,
     61
    ],
    "metrics": {
     "slide": 55.5,
     "skate": 3.64,
     "penetration": 3.93,
     "bodyPenetration": 0,
     "intersection": 0.25,
     "jitter": 1.03,
     "pop": 495.38,
     "twistFlip": 68,
     "jointLimit": 26,
     "stretch": 0,
     "seam": 0,
     "seamVelocity": 0,
     "fit": 11,
     "nan": 0,
     "events": 0,
     "symmetry": 0,
     "skateMean": 1.47
    }
   }
  },
  {
   "ref": "STYLE100_IDLE/OnPhoneRight_Idle@c3e667b9620d",
   "id": "STYLE100_IDLE/OnPhoneRight_Idle",
   "hash": "c3e667b9620d3ff9da5c96164ed6f9a8dc598112b4d5aaf3f2ae87b01d397993",
   "tier": "cc-by",
   "review": null,
   "stale": false,
   "numbers": {
    "verdict": "pass",
    "findings": 0,
    "fail": 0,
    "dur": 2.5,
    "keys": 4,
    "fit": [
     4,
     11
    ],
    "metrics": {
     "slide": 2.03,
     "skate": 0.08,
     "penetration": 0,
     "bodyPenetration": 0,
     "intersection": 0.1,
     "jitter": 0,
     "pop": 13.79,
     "twistFlip": 37,
     "jointLimit": 1,
     "stretch": 0,
     "seam": 0,
     "seamVelocity": 25.21,
     "fit": 4,
     "nan": 0,
     "events": 0,
     "symmetry": 0,
     "skateMean": 0.04
    }
   }
  },
  {
   "ref": "STYLE100_IDLE/HandsBetweenLegs_Idle@793c0b9ab408",
   "id": "STYLE100_IDLE/HandsBetweenLegs_Idle",
   "hash": "793c0b9ab4083223ece37432205b24116c4326c7180d3f26fd6245adf18f0cff",
   "tier": "cc-by",
   "review": null,
   "stale": false,
   "numbers": {
    "verdict": "pass",
    "findings": 0,
    "fail": 0,
    "dur": 2.5,
    "keys": 4,
    "fit": [
     4,
     16
    ],
    "metrics": {
     "slide": 4.79,
     "skate": 0.19,
     "penetration": 0,
     "bodyPenetration": 0,
     "intersection": 0.05,
     "jitter": 0,
     "pop": 31.12,
     "twistFlip": 5,
     "jointLimit": 8,
     "stretch": 0,
     "seam": 0,
     "seamVelocity": 7.7,
     "fit": 4,
     "nan": 0,
     "events": 0,
     "symmetry": 0,
     "skateMean": 0.1
    }
   }
  },
  {
   "ref": "STYLE100_IDLE/Aeroplane_Idle@f6ab01f41e78",
   "id": "STYLE100_IDLE/Aeroplane_Idle",
   "hash": "f6ab01f41e7895611ba0d0fdd95f1b6addc7b59af26b6925f2f2a84c05e891bb",
   "tier": "cc-by",
   "review": null,
   "stale": false,
   "numbers": {
    "verdict": "pass",
    "findings": 0,
    "fail": 0,
    "dur": 2.5,
    "keys": 5,
    "fit": [
     6,
     28
    ],
    "metrics": {
     "slide": 0.01,
     "skate": 0,
     "penetration": 0,
     "bodyPenetration": 0,
     "intersection": 0.02,
     "jitter": 0,
     "pop": 10.94,
     "twistFlip": 5,
     "jointLimit": 26,
     "stretch": 0,
     "seam": 0,
     "seamVelocity": 12.91,
     "fit": 6,
     "nan": 0,
     "events": 0,
     "symmetry": 0,
     "skateMean": 0
    }
   }
  },
  {
   "ref": "MESH2MOTION/Glide@a10d8aa85ce6",
   "id": "MESH2MOTION/Glide",
   "hash": "a10d8aa85ce631134c35512fd3647022eb4183798aa733de125eff6bba1fea1c",
   "tier": "cc0",
   "review": null,
   "stale": false,
   "numbers": {
    "verdict": "pass",
    "findings": 0,
    "fail": 0,
    "dur": 0.792,
    "keys": 4,
    "fit": [
     8,
     47
    ],
    "metrics": {
     "slide": 0,
     "skate": 0,
     "penetration": 0,
     "bodyPenetration": 0,
     "intersection": 0,
     "jitter": 0,
     "pop": 117.67,
     "twistFlip": 9,
     "jointLimit": 3,
     "stretch": 0,
     "seam": 1.1,
     "seamVelocity": 198.27,
     "fit": 8,
     "nan": 0,
     "events": 0,
     "symmetry": 0,
     "skateMean": 0
    }
   }
  },
  {
   "ref": "STYLE100_IDLE/HighKnees_Idle@0fcd61774bcb",
   "id": "STYLE100_IDLE/HighKnees_Idle",
   "hash": "0fcd61774bcbe6ee3cbd9683d586d4620c7428baad9fec8dbc89b2b8ba20637e",
   "tier": "cc-by",
   "review": null,
   "stale": false,
   "numbers": {
    "verdict": "pass",
    "findings": 0,
    "fail": 0,
    "dur": 2.533,
    "keys": 4,
    "fit": [
     5,
     18
    ],
    "metrics": {
     "slide": 0.06,
     "skate": 0,
     "penetration": 0,
     "bodyPenetration": 0,
     "intersection": 0.34,
     "jitter": 0,
     "pop": 7.16,
     "twistFlip": 11,
     "jointLimit": 0,
     "stretch": 0,
     "seam": 0,
     "seamVelocity": 8.48,
     "fit": 5,
     "nan": 0,
     "events": 0,
     "symmetry": 0,
     "skateMean": 0
    }
   }
  },
  {
   "ref": "STYLE100_IDLE/LeanRight_Idle@7580ebfaed03",
   "id": "STYLE100_IDLE/LeanRight_Idle",
   "hash": "7580ebfaed03afc74e4185ca4a49e6c45a576e276fab8fbec488c1a63a429741",
   "tier": "cc-by",
   "review": null,
   "stale": false,
   "numbers": {
    "verdict": "pass",
    "findings": 0,
    "fail": 0,
    "dur": 2.5,
    "keys": 6,
    "fit": [
     6,
     15
    ],
    "metrics": {
     "slide": 0.28,
     "skate": 0.01,
     "penetration": 3.38,
     "bodyPenetration": 0,
     "intersection": 0.12,
     "jitter": 0.03,
     "pop": 39.44,
     "twistFlip": 8,
     "jointLimit": 21,
     "stretch": 0,
     "seam": 0,
     "seamVelocity": 22.33,
     "fit": 6,
     "nan": 0,
     "events": 0,
     "symmetry": 0,
     "skateMean": 0.01
    }
   }
  },
  {
   "ref": "STYLE100_IDLE/March_Idle@4287b1411ada",
   "id": "STYLE100_IDLE/March_Idle",
   "hash": "4287b1411ada6fe8800bd2060908a5ee9966bcd3b1f101bdc358283b441ab695",
   "tier": "cc-by",
   "review": null,
   "stale": false,
   "numbers": {
    "verdict": "pass",
    "findings": 0,
    "fail": 0,
    "dur": 2.5,